{
  "checks": {
    "no_classifier_trained": true,
    "no_model_weights_loaded": true,
    "source_counts_reconcile": true,
    "taxonomy_complete": true,
    "test_accessed": false,
    "tokenizer_revision_pinned": true,
    "train_only_query": true,
    "validation_accessed": false
  },
  "claims": {
    "interpretation": "training_input_retention_profile_not_model_performance",
    "portfolio_promotion_approved": false,
    "predictive_performance_measured": false
  },
  "created_at_utc": "2026-07-23T14:55:18.265186Z",
  "data": {
    "feature_input": "consumer_complaint_narrative_only",
    "labels": [
      "Checking or savings account",
      "Credit card",
      "Credit reporting or other personal consumer reports",
      "Debt collection",
      "Debt or credit management",
      "Money transfer, virtual currency, or money service",
      "Mortgage",
      "Payday loan, title loan, personal loan, or advance loan",
      "Prepaid card",
      "Student loan",
      "Vehicle loan or lease"
    ],
    "profiled_split": "train",
    "queried_splits": [
      "train"
    ],
    "test_accessed": false,
    "train_record_count": 394564,
    "validation_accessed": false
  },
  "decision": {
    "maximum_length_selected": false,
    "next_gate": "select_maximum_length_before_CT-302",
    "requires_owner_approval": true
  },
  "measurement": {
    "by_class": {
      "Checking or savings account": {
        "candidate_lengths": [
          {
            "maximum_length": 128,
            "records_exceeding": 19552,
            "retained_token_ratio": 0.390475,
            "share_records_exceeding": 0.710956
          },
          {
            "maximum_length": 256,
            "records_exceeding": 11041,
            "retained_token_ratio": 0.631785,
            "share_records_exceeding": 0.401476
          },
          {
            "maximum_length": 384,
            "records_exceeding": 6198,
            "retained_token_ratio": 0.765893,
            "share_records_exceeding": 0.225374
          },
          {
            "maximum_length": 512,
            "records_exceeding": 3579,
            "retained_token_ratio": 0.842365,
            "share_records_exceeding": 0.130141
          }
        ],
        "maximum": 7222,
        "mean": 290.029635,
        "minimum": 5,
        "quantiles": {
          "p50": 210,
          "p75": 361,
          "p90": 584,
          "p95": 782,
          "p99": 1481
        },
        "record_count": 27501,
        "token_count": 7976105
      },
      "Credit card": {
        "candidate_lengths": [
          {
            "maximum_length": 128,
            "records_exceeding": 20054,
            "retained_token_ratio": 0.394705,
            "share_records_exceeding": 0.665759
          },
          {
            "maximum_length": 256,
            "records_exceeding": 11479,
            "retained_token_ratio": 0.63293,
            "share_records_exceeding": 0.381084
          },
          {
            "maximum_length": 384,
            "records_exceeding": 6336,
            "retained_token_ratio": 0.765562,
            "share_records_exceeding": 0.210345
          },
          {
            "maximum_length": 512,
            "records_exceeding": 3658,
            "retained_token_ratio": 0.839724,
            "share_records_exceeding": 0.121439
          }
        ],
        "maximum": 6800,
        "mean": 276.639234,
        "minimum": 4,
        "quantiles": {
          "p50": 197,
          "p75": 346,
          "p90": 559,
          "p95": 771,
          "p99": 1460
        },
        "record_count": 30122,
        "token_count": 8332927
      },
      "Credit reporting or other personal consumer reports": {
        "candidate_lengths": [
          {
            "maximum_length": 128,
            "records_exceeding": 164935,
            "retained_token_ratio": 0.36814,
            "share_records_exceeding": 0.664894
          },
          {
            "maximum_length": 256,
            "records_exceeding": 93323,
            "retained_token_ratio": 0.586324,
            "share_records_exceeding": 0.376208
          },
          {
            "maximum_length": 384,
            "records_exceeding": 51554,
            "retained_token_ratio": 0.708465,
            "share_records_exceeding": 0.207827
          },
          {
            "maximum_length": 512,
            "records_exceeding": 32421,
            "retained_token_ratio": 0.77923,
            "share_records_exceeding": 0.130697
          }
        ],
        "maximum": 10712,
        "mean": 298.374999,
        "minimum": 4,
        "quantiles": {
          "p50": 193,
          "p75": 344,
          "p90": 603,
          "p95": 842,
          "p99": 2058
        },
        "record_count": 248062,
        "token_count": 74015499
      },
      "Debt collection": {
        "candidate_lengths": [
          {
            "maximum_length": 128,
            "records_exceeding": 23120,
            "retained_token_ratio": 0.447645,
            "share_records_exceeding": 0.559468
          },
          {
            "maximum_length": 256,
            "records_exceeding": 11557,
            "retained_token_ratio": 0.673055,
            "share_records_exceeding": 0.279661
          },
          {
            "maximum_length": 384,
            "records_exceeding": 6255,
            "retained_token_ratio": 0.790231,
            "share_records_exceeding": 0.151361
          },
          {
            "maximum_length": 512,
            "records_exceeding": 3585,
            "retained_token_ratio": 0.855302,
            "share_records_exceeding": 0.086751
          }
        ],
        "maximum": 6949,
        "mean": 228.131059,
        "minimum": 3,
        "quantiles": {
          "p50": 148,
          "p75": 280,
          "p90": 479,
          "p95": 652,
          "p99": 1295
        },
        "record_count": 41325,
        "token_count": 9427516
      },
      "Debt or credit management": {
        "candidate_lengths": [
          {
            "maximum_length": 128,
            "records_exceeding": 631,
            "retained_token_ratio": 0.428126,
            "share_records_exceeding": 0.537937
          },
          {
            "maximum_length": 256,
            "records_exceeding": 340,
            "retained_token_ratio": 0.652422,
            "share_records_exceeding": 0.289855
          },
          {
            "maximum_length": 384,
            "records_exceeding": 203,
            "retained_token_ratio": 0.778259,
            "share_records_exceeding": 0.173061
          },
          {
            "maximum_length": 512,
            "records_exceeding": 125,
            "retained_token_ratio": 0.852152,
            "share_records_exceeding": 0.106564
          }
        ],
        "maximum": 2688,
        "mean": 231.228474,
        "minimum": 6,
        "quantiles": {
          "p50": 145,
          "p75": 293,
          "p90": 530,
          "p95": 731,
          "p99": 1317
        },
        "record_count": 1173,
        "token_count": 271231
      },
      "Money transfer, virtual currency, or money service": {
        "candidate_lengths": [
          {
            "maximum_length": 128,
            "records_exceeding": 6668,
            "retained_token_ratio": 0.380859,
            "share_records_exceeding": 0.704714
          },
          {
            "maximum_length": 256,
            "records_exceeding": 3857,
            "retained_token_ratio": 0.616665,
            "share_records_exceeding": 0.407631
          },
          {
            "maximum_length": 384,
            "records_exceeding": 2121,
            "retained_token_ratio": 0.748404,
            "share_records_exceeding": 0.22416
          },
          {
            "maximum_length": 512,
            "records_exceeding": 1269,
            "retained_token_ratio": 0.824446,
            "share_records_exceeding": 0.134115
          }
        ],
        "maximum": 6050,
        "mean": 296.364088,
        "minimum": 5,
        "quantiles": {
          "p50": 210,
          "p75": 361,
          "p90": 597,
          "p95": 830,
          "p99": 1571
        },
        "record_count": 9462,
        "token_count": 2804197
      },
      "Mortgage": {
        "candidate_lengths": [
          {
            "maximum_length": 128,
            "records_exceeding": 9762,
            "retained_token_ratio": 0.312233,
            "share_records_exceeding": 0.804384
          },
          {
            "maximum_length": 256,
            "records_exceeding": 6227,
            "retained_token_ratio": 0.532779,
            "share_records_exceeding": 0.513102
          },
          {
            "maximum_length": 384,
            "records_exceeding": 3829,
            "retained_token_ratio": 0.669487,
            "share_records_exceeding": 0.315508
          },
          {
            "maximum_length": 512,
            "records_exceeding": 2484,
            "retained_token_ratio": 0.755616,
            "share_records_exceeding": 0.20468
          }
        ],
        "maximum": 6977,
        "mean": 379.669331,
        "minimum": 4,
        "quantiles": {
          "p50": 263,
          "p75": 452,
          "p90": 755,
          "p95": 1042,
          "p99": 2236
        },
        "record_count": 12136,
        "token_count": 4607667
      },
      "Payday loan, title loan, personal loan, or advance loan": {
        "candidate_lengths": [
          {
            "maximum_length": 128,
            "records_exceeding": 2939,
            "retained_token_ratio": 0.41353,
            "share_records_exceeding": 0.618607
          },
          {
            "maximum_length": 256,
            "records_exceeding": 1582,
            "retained_token_ratio": 0.646066,
            "share_records_exceeding": 0.332983
          },
          {
            "maximum_length": 384,
            "records_exceeding": 862,
            "retained_token_ratio": 0.769705,